{"content_version":"v20260706-1","days":[{"date":"2026-07-06","grade_tier":"lookout","puzzle":"bf1-5x5-000001"},{"date":"2026-07-07","grade_tier":"lookout","puzzle":"bf1-5x5-000002"},{"date":"2026-07-08","grade_tier":"crew","puzzle":"bf1-6x6-000001"},{"date":"2026-07-09","grade_tier":"crew","puzzle":"bf1-6x6-000002"},{"date":"2026-07-10","grade_tier":"crew","puzzle":"bf1-6x6-000003"},{"date":"2026-07-11","grade_tier":"hotshot","puzzle":"bf1-7x7-000001"},{"date":"2026-07-12","grade_tier":"crew","puzzle":"bf1-8x8-000001"}],"files":{"og/bf1-5x5-000001.png":"69231b851d77d71822afd215cd839d45e1ce022467c9cd32e07a99bbd606633a","og/bf1-5x5-000002.png":"2476445bb3220d35c876576bc37e47c5daec164ea43ba759e092b86d02d8337c","og/bf1-5x5-000003.png":"37033619fc5222159a62f4d867392466511f57b1e514ae7bdf82c1bd89cd128a","og/bf1-5x5-000004.png":"717f6aa310350b301599dcf4a72339c00b6cee902498f020c472e7c1b776206f","og/bf1-5x5-000005.png":"210090767256b3487d26dbdddf03d63c0c2afb64074f4bf4941fe10bd05e3774","og/bf1-5x5-000006.png":"ee194ef2a2a07b2dfa5892957dc2d47e10447862968aaf8ffeb0b635ef4e61c3","og/bf1-5x5-000007.png":"1beab626028d4b972d3a23e5b7191da35883578567bc0b7ad2f4d3d74225605d","og/bf1-5x5-000008.png":"e813d6efa38684eaa5430008fcf5262c5bbff9fcd79430efd6925bb2d8c80213","og/bf1-5x5-000009.png":"167c928656d1cee27b13a15e8a6ec4bcda2ff64d5a6c183c3ba91be8d33239d2","og/bf1-5x5-000010.png":"94c755606ca844540eb22f08ac657cc45ce0f11da1c672b97b39cbdf8e88b059","og/bf1-5x5-000011.png":"6d20fec0e952b783af659753ffd1fd88d1cb49862ca042798393b4730166147d","og/bf1-5x5-000012.png":"5b7b5a1166565a61c071220f5eaa4bd982790eb6368275097f5b555653fc8b87","og/bf1-6x6-000001.png":"f5823eaf9581e7ccb95f73e1e4a5ec5c4be97ddf3c2c2e2d8e29527cfa9f1cc5","og/bf1-6x6-000002.png":"8e980c388bbf3e0fded485a59f1dc8baffcc706bf1038945fa60399c517485fd","og/bf1-6x6-000003.png":"e61b7d3545b0b0d0a9f825d72a56c7e15264dc657fc0a8958609bac9f86b75a6","og/bf1-6x6-000004.png":"af868c86772f8c1fa016995eecec498beebae1a704acb85a7515ecd3332bf8e2","og/bf1-6x6-000005.png":"557d88e662d63c48d82df8b9fa99dd21ac3e5e970f6afab6dfd98bc559cd6b9e","og/bf1-7x7-000001.png":"c2fb1ff2225aa18f15a0f932f49915d9322ee2be3c1a11448da4940f07bac65e","og/bf1-7x7-000002.png":"72de7be4d8daad8d57e8b1cb24402e0ffc2bc46845d053a0f6b62d30fd32c98b","og/bf1-7x7-000003.png":"36b078ac278a79ddb551bde6737b40fb7ad658b367ae5d459b731e5a4a5690e8","og/bf1-8x8-000001.png":"1d498271ed4687ac1cf4ccdbfcd6d1492009615bdf825b9165e4f3f3bb3b665c","packs/academy-1.json":"278bc3c992405c1394c2ed1e255ab3b504ae8607d95e2daf452774506b026eca","puzzles.csv":"ff296d1ca602f2453097b1213a397126d29190c5628b2bc7cabca11c5b41dcf4","puzzles/bf1-5x5-000001.json":"4916c5eb28d84f0959f4b713293867a3e7ba7dbfe1dce27cf4387c17cb440bfd","puzzles/bf1-5x5-000002.json":"da95daf787ac08cc835566cc946b6c3f6df6f27a320e2f1e460851995ab2c67d","puzzles/bf1-5x5-000003.json":"1571471dbe09fed285a589fef2740b6ebc33fae049ed2430ff595f4ac7b14c75","puzzles/bf1-5x5-000004.json":"500b94e62ffe58dfeb2d4082d0fbe8a34cfac35b2803a1842e496fe4707ec46e","puzzles/bf1-5x5-000005.json":"005bd64e312260cef3a8221a20697e7b2718bbb908f1ceae19994b04c0f4a721","puzzles/bf1-5x5-000006.json":"3ff6d179dbde84d2bcdc19be2cdad0ba75740f93e155be20b63b8d5746145502","puzzles/bf1-5x5-000007.json":"4d8a75fcfcdbd82086c63b07601e923e02dd8bc6d441b6698db873b711a0459b","puzzles/bf1-5x5-000008.json":"301d9e1a22db02c1fe282331e4ff507d77cb74f758187968295732dd21404fa2","puzzles/bf1-5x5-000009.json":"5d96b1239bef777c28a213fbb160ba27f2bdcfa4d3d94370c2e53c143694a66f","puzzles/bf1-5x5-000010.json":"39ef3bc4620246fc96de25a3626754edc3d5044af5cf33e046e48b14e19331bc","puzzles/bf1-5x5-000011.json":"5ad1c3ca527d88e2f72fd22ff1eb4d8459613e8334438af7bf2378eaacd0521e","puzzles/bf1-5x5-000012.json":"3ab6d95425a3f12670b352b92efcb2f476bfd0c674bac00e4faf1381eee281f5","puzzles/bf1-6x6-000001.json":"d846d1eddab1571a07f6bcc7f1f502734120a42f376fc5692103e1deeef8f58c","puzzles/bf1-6x6-000002.json":"93963506776077207dc293436476fc49512e3f10d90a8356cefd78716503a318","puzzles/bf1-6x6-000003.json":"f51daa500d34461c77116fa6dddbde4f49ff25c218b24a697150167c2b5bd2c9","puzzles/bf1-6x6-000004.json":"4b7395e75d30f17c12d30d2b2e7f51b28bab8456aaa997f189ac1088d62d6efa","puzzles/bf1-6x6-000005.json":"6e532fb3406ae1747984b2a7165d239603f298fb1bfbdb08d0daee2fdadff3f0","puzzles/bf1-7x7-000001.json":"abfdcf03885bd7859a15ed1030cbbd5341dcdddf4395377c70381881e4265efe","puzzles/bf1-7x7-000002.json":"1f6610e10aaae746221f05930e8281945b9fa52d3aca309d162fcf92b9f19ebf","puzzles/bf1-7x7-000003.json":"cbd364e68a7815ef4ea33152df5b6129766db9e9bfce3b188f2764c87ff43b96","puzzles/bf1-8x8-000001.json":"fea499650b776d38d4c36aa5153f6f10ffa9112f6992b4cafc10eacbf163cbe5"},"from":"2026-07-06","schema":"burnfront.calendar/1","to":"2026-07-12"}
